{
  "schema_version": 1,
  "id": "review.catalogue.silver-chloride.cr-001",
  "catalogue_digest": "eb3a482dc98bb68653dd7748675da6e5adca7264ed0165a05cc930b9c1c6d595",
  "reviewer": "independent Codex review agent /root/slice3_review",
  "reviewed_on": "2026-07-13",
  "scope": "Identity records and empirical facts in silver-chloride-001.catalogue.json",
  "method": "Source-by-source audit followed by schema, digest, semantic, test, lint, documentation, and conformance validation",
  "sources": [
    "iupac.periodic-table",
    "openstax.reaction-classification",
    "openstax.solubility",
    "openstax.precipitation",
    "pubchem.silver-chloride"
  ],
  "coverage_conclusion": "No completeness or no-reaction coverage is approved; the sources support the included positive facts but not reaction-family exhaustion.",
  "limitation": "This independent automated source audit is a conformance-fixture review, not human chemistry-owner approval for public educational content."
}
